{
  "$schema": "https://json-schema.org/draft/2020-12/schema",
  "$id": "https://github.com/Simus100/altair-brain/schema/areas.schema.json",
  "title": "areas.json — il registro delle macroaree di un brain",
  "description": "Unica fonte delle aree: scaffolding delle cartelle, instradamento delle domande (keywords), freschezza (sla_giorni), coesione del grafo, strati generati, colore nell'atlante. Dal formato 1.1 le parole chiave stanno qui e non piu' in engine/router.json.",
  "type": "object",
  "required": ["schema_version", "areas"],
  "additionalProperties": false,
  "properties": {
    "schema_version": {"type": "integer", "minimum": 1},
    "descrizione": {"type": "string"},
    "convenzione": {"type": "object", "additionalProperties": {"type": "string"}},
    "areas": {"type": "array", "items": {"$ref": "#/$defs/area"}}
  },
  "$defs": {
    "area": {
      "type": "object",
      "required": ["id", "label", "status"],
      "additionalProperties": false,
      "properties": {
        "id": {"type": "string", "pattern": "^[a-z0-9]+(-[a-z0-9]+)*$",
               "description": "kebab-case ascii: coincide con raw/<id>/ e wiki/<id>/"},
        "label": {"type": "string", "minLength": 1},
        "description": {"type": "string"},
        "status": {"enum": ["active", "draft", "archived"]},
        "sla_giorni": {"type": ["integer", "null"], "minimum": 1,
                       "description": "giorni prima che una nota vada ri-verificata; null = non scade"},
        "coesa": {"type": "boolean",
                  "description": "true = lo strato grezzo dell'area deve restare un solo componente connesso"},
        "generata_da": {"type": "string",
                        "description": "se presente, wiki/<id>/ e' GENERATA da questo file (non si edita a mano)"},
        "keywords": {"type": "array", "items": {"type": "string", "minLength": 2},
                     "description": "parole che instradano una domanda a quest'area (match per sottostringa)"},
        "budget": {"type": "integer", "minimum": 200,
                   "description": "budget di token predefinito per le domande instradate qui"},
        "colore": {"type": "string", "pattern": "^#[0-9a-fA-F]{6}$",
                   "description": "colore dello spicchio nell'atlante 3D"}
      }
    }
  }
}
