{
  "schema_version": 1,
  "descrizione": "Registro delle macroaree del second brain. Fonte di verita unica per scaffolding, router e gate di sicurezza. Aggiungere un'area = aggiungere una voce qui + la cartella raw/<id>/.",
  "convenzione": {
    "id": "kebab-case ascii, nessuno spazio; coincide col nome della cartella in raw/<id>/",
    "bridge": "i concetti condivisi tra aree, scritti con lo stesso nome esatto, vengono fusi dal grafo e diventano ponti intercampo",
    "status": "active | draft | archived",
    "generata_da": "se presente, wiki/<id>/ e GENERATA da questo file: niente front-matter a mano",
    "sla_giorni": "giorni prima che una nota vada ri-verificata; null = non scade",
    "coesa": "true = l'area deve restare un solo componente connesso nel grafo",
    "keywords": "parole che instradano una domanda a quest'area (sottostringa)",
    "colore": "colore dello spicchio nell'atlante 3D"
  },
  "areas": [
    {
      "id": "aion",
      "label": "AION",
      "description": "Modello di pensiero AION: framework concettuale, principi, struttura e applicazioni.",
      "status": "active",
      "generata_da": "engine/aion.model.json",
      "sla_giorni": null,
      "coesa": true,
      "keywords": [
        "aion",
        "superia",
        "ethos",
        "oracolo",
        "oracle",
        "i ching",
        "esagramma",
        "trigramma",
        "agente",
        "fabula",
        "analyst",
        "insegnament",
        "modalita",
        "narrazion",
        "archetip",
        "hybrid",
        "reasoner",
        "deeplogic",
        "velario",
        "modello di pensiero",
        "cinematica",
        "synth"
      ],
      "budget": 2000,
      "colore": "#a78bfa"
    },
    {
      "id": "data-science",
      "label": "Data science",
      "description": "Machine learning, statistica, analisi dati, MLOps, strumenti e metodi.",
      "status": "active",
      "sla_giorni": 365,
      "keywords": [
        "data science",
        "data-science",
        "analisi dati",
        "analisi di dati",
        "dataset",
        "data cleaning",
        "pulizia dati",
        "outlier",
        "quartile",
        "iqr",
        "feature",
        "colonna derivata",
        "colonne derivate",
        "pivot",
        "excel",
        "power bi",
        "powerbi",
        "looker",
        "dashboard",
        "report",
        "reportistica",
        "sql",
        "postgres",
        "mongodb",
        "database",
        "query",
        "pandas",
        "python",
        "jupyter",
        "docker",
        "storytelling",
        "visualizzazione",
        "statistic",
        "media",
        "mediana",
        "machine learning",
        "mlops",
        "kpi",
        "insight",
        "schema er",
        "prenotazioni",
        "assicurativ",
        "olist",
        "ecommerce",
        "social media",
        "hotel",
        "insurance",
        "analista",
        "analyst"
      ],
      "budget": 2000,
      "colore": "#22d3ee"
    },
    {
      "id": "finanza",
      "label": "Finanza",
      "description": "Mercati, fiscale, contabilita, investimenti, gestione d'impresa.",
      "status": "active",
      "keywords": [
        "finanz",
        "fiscal",
        "investiment",
        "mercat",
        "contabil",
        "tasse",
        "bilancio",
        "portafoglio",
        "rendiment",
        "trading",
        "azioni"
      ],
      "budget": 2000,
      "colore": "#fbbf24"
    },
    {
      "id": "divulgazione",
      "label": "Divulgazione",
      "description": "Comunicazione, scrittura, contenuti, public speaking, didattica.",
      "status": "active",
      "keywords": [
        "divulgazion",
        "comunicazion",
        "scrittura",
        "articolo",
        "public speaking",
        "contenut",
        "pubblico",
        "storytelling narrativo",
        "presentazione"
      ],
      "budget": 2000,
      "colore": "#34d399"
    },
    {
      "id": "web-design",
      "label": "Web design",
      "description": "UI/UX, front-end, design system, accessibilita, prototipazione.",
      "status": "draft",
      "keywords": [
        "ui/ux",
        "ux",
        "css",
        "front-end",
        "frontend",
        "design system",
        "accessibilit",
        "prototip",
        "layout",
        "responsive",
        "figma",
        "wireframe"
      ],
      "budget": 2000,
      "colore": "#fb923c"
    },
    {
      "id": "creativita",
      "label": "Creatività",
      "description": "Scrittura creativa e produzione editoriale: BookForge — sistema per scrivere libri con l'AI. StyleDNA (vettore stilistico a 12 assi), verifica stilometrica eseguibile, protocolli anti-AI, psicologia del personaggio, continuita di collana, pubblicazione KDP.",
      "status": "active",
      "keywords": [
        "anti-ai",
        "artificiale",
        "beat",
        "beta-reader",
        "bookforge",
        "bozza",
        "capitolo",
        "chiarezza",
        "cliche",
        "dialogo",
        "draft",
        "editing",
        "editoria",
        "enneagramma",
        "frase",
        "incipit",
        "kdp",
        "lettore",
        "libro",
        "manierismo",
        "metafora",
        "narrativa",
        "narrazione",
        "paragrafo",
        "personaggio",
        "prosa",
        "pubblicare",
        "pubblicazione",
        "registro",
        "revisione",
        "ritmo",
        "romanzo",
        "scena",
        "scrittura",
        "scrivere",
        "sottotesto",
        "stile",
        "stilometria",
        "styledna",
        "stylometry",
        "testo",
        "tic",
        "trama",
        "voce"
      ],
      "budget": 2000,
      "colore": "#f472b6"
    }
  ]
}
